{
  "spec_version": "v1.0",
  "generated_at": "2026-03-12T13:21:34Z",
  "gaps": [
    {
      "gap_id": "gap:contract-boundary",
      "title": "Service-to-protocol coordination is only partially evidenced",
      "expected_state": "Versioning, ownership, and contract rollout between service and protocol repos are explicit.",
      "observed_state": "Available evidence suggests: The reposet shows a service repo consuming a protocol repo, but coordination still depends on unresolved operator knowledge.",
      "gap_type": "partial",
      "severity": "high",
      "status": "triaged",
      "supporting_claim_ids": [
        "finding:contract-boundary:final"
      ],
      "affected_repos": [
        "repo:sdp",
        "repo:sdp_dev"
      ],
      "recommended_actions": [
        "Add contract rollout checks before cross-repo changes land.",
        "Record protocol ownership and versioning rules in the reposet bootstrap plan."
      ]
    },
    {
      "gap_id": "gap:hotspot-risk",
      "title": "Hotspot concentration still limits autonomous change scope",
      "expected_state": "High-risk files are isolated behind tests or reduced into narrow modules.",
      "observed_state": "Repo memory still tracks 110 hotspot zones, so broad autonomous changes would overreach.",
      "gap_type": "partial",
      "severity": "medium",
      "status": "accepted",
      "supporting_claim_ids": [
        "finding:hotspot-risk:final"
      ],
      "affected_repos": [
        "repo:sdp",
        "repo:sdp_dev"
      ],
      "recommended_actions": [
        "Fence the largest hotspots with narrow workstreams before orchestration expands scope."
      ]
    },
    {
      "gap_id": "gap:unresolved-questions",
      "title": "Open questions still block confident synthesis",
      "expected_state": "Important cross-repo questions are answered or explicitly assigned to owners.",
      "observed_state": "Available evidence suggests: Reality memory still carries 2 unresolved question(s), so some claims would overstate certainty.",
      "gap_type": "ambiguous",
      "severity": "medium",
      "status": "triaged",
      "supporting_claim_ids": [
        "finding:unresolved-questions:final"
      ],
      "affected_repos": [
        "repo:sdp",
        "repo:sdp_dev"
      ],
      "recommended_actions": [
        "Promote unresolved questions into explicit bootstrap backlog items with owners."
      ]
    }
  ],
  "claims": [
    {
      "claim_id": "finding:contract-boundary:final",
      "title": "Service-to-protocol coordination is only partially evidenced",
      "statement": "Available evidence suggests: The reposet shows a service repo consuming a protocol repo, but coordination still depends on unresolved operator knowledge.",
      "status": "inferred",
      "confidence": 0.67,
      "source_ids": [
        "source:evidence:docs:ADR-0001-go-first-stack.md",
        "source:evidence:docs:AGENT_ARTIFACT_COMMUNICATION_PROTOCOL.md",
        "source:evidence:docs:AGENT_HANDOFF.md",
        "source:evidence:docs:AGENT_HOOKS_SPEC.md",
        "source:multi-repo-map",
        "source:repo-memory"
      ],
      "review_state": "arbitrated",
      "affected_repos": [
        "repo:sdp",
        "repo:sdp_dev"
      ],
      "open_questions": [
        "sdp: how does this repo coordinate versioning with the rest of the reposet?",
        "sdp_dev: how does this repo coordinate versioning with the rest of the reposet?"
      ],
      "tags": [
        "final",
        "architecture-analyst"
      ],
      "counter_evidence": [
        "Repo memory captures repository shape, but not full operator intent or historical rollout decisions."
      ]
    },
    {
      "claim_id": "finding:contract-boundary:primary",
      "title": "Service-to-protocol coordination is only partially evidenced",
      "statement": "The reposet shows a service repo consuming a protocol repo, but coordination still depends on unresolved operator knowledge.",
      "status": "observed",
      "confidence": 0.88,
      "source_ids": [
        "source:evidence:docs:ADR-0001-go-first-stack.md",
        "source:evidence:docs:AGENT_ARTIFACT_COMMUNICATION_PROTOCOL.md",
        "source:evidence:docs:AGENT_HANDOFF.md",
        "source:evidence:docs:AGENT_HOOKS_SPEC.md",
        "source:multi-repo-map",
        "source:repo-memory"
      ],
      "review_state": "cross_checked",
      "affected_repos": [
        "repo:sdp",
        "repo:sdp_dev"
      ],
      "open_questions": [
        "sdp: how does this repo coordinate versioning with the rest of the reposet?",
        "sdp_dev: how does this repo coordinate versioning with the rest of the reposet?"
      ],
      "tags": [
        "primary",
        "architecture-analyst"
      ]
    },
    {
      "claim_id": "finding:contract-boundary:skeptic",
      "title": "Service-to-protocol coordination is only partially evidenced skeptic review",
      "statement": "Topology proves dependency direction, but governance and rollout discipline are still inferred rather than observed.",
      "status": "inferred",
      "confidence": 0.62,
      "source_ids": [
        "source:evidence:docs:ADR-0001-go-first-stack.md",
        "source:evidence:docs:AGENT_ARTIFACT_COMMUNICATION_PROTOCOL.md",
        "source:evidence:docs:AGENT_HANDOFF.md",
        "source:evidence:docs:AGENT_HOOKS_SPEC.md",
        "source:multi-repo-map",
        "source:repo-memory"
      ],
      "review_state": "challenged",
      "affected_repos": [
        "repo:sdp",
        "repo:sdp_dev"
      ],
      "open_questions": [
        "sdp: how does this repo coordinate versioning with the rest of the reposet?",
        "sdp_dev: how does this repo coordinate versioning with the rest of the reposet?"
      ],
      "tags": [
        "skeptic",
        "architecture-analyst"
      ],
      "counter_evidence": [
        "Repo memory captures repository shape, but not full operator intent or historical rollout decisions."
      ]
    },
    {
      "claim_id": "finding:hotspot-risk:final",
      "title": "Hotspot concentration still limits autonomous change scope",
      "statement": "Repo memory still tracks 110 hotspot zones, so broad autonomous changes would overreach.",
      "status": "observed",
      "confidence": 0.88,
      "source_ids": [
        "source:repo-memory"
      ],
      "review_state": "arbitrated",
      "affected_repos": [
        "repo:sdp",
        "repo:sdp_dev"
      ],
      "tags": [
        "final",
        "test-quality-analyst"
      ]
    },
    {
      "claim_id": "finding:hotspot-risk:primary",
      "title": "Hotspot concentration still limits autonomous change scope",
      "statement": "Repo memory still tracks 110 hotspot zones, so broad autonomous changes would overreach.",
      "status": "observed",
      "confidence": 0.88,
      "source_ids": [
        "source:repo-memory"
      ],
      "review_state": "cross_checked",
      "affected_repos": [
        "repo:sdp",
        "repo:sdp_dev"
      ],
      "tags": [
        "primary",
        "test-quality-analyst"
      ]
    },
    {
      "claim_id": "finding:hotspot-risk:skeptic",
      "title": "Hotspot concentration still limits autonomous change scope skeptic review",
      "statement": "The evidence is sufficient to keep this finding without further downgrade.",
      "status": "observed",
      "confidence": 0.82,
      "source_ids": [
        "source:repo-memory"
      ],
      "review_state": "cross_checked",
      "affected_repos": [
        "repo:sdp",
        "repo:sdp_dev"
      ],
      "tags": [
        "skeptic",
        "test-quality-analyst"
      ]
    },
    {
      "claim_id": "finding:unresolved-questions:final",
      "title": "Open questions still block confident synthesis",
      "statement": "Available evidence suggests: Reality memory still carries 2 unresolved question(s), so some claims would overstate certainty.",
      "status": "inferred",
      "confidence": 0.67,
      "source_ids": [
        "source:repo-memory"
      ],
      "review_state": "arbitrated",
      "affected_repos": [
        "repo:sdp",
        "repo:sdp_dev"
      ],
      "open_questions": [
        "sdp: how does this repo coordinate versioning with the rest of the reposet?",
        "sdp_dev: how does this repo coordinate versioning with the rest of the reposet?"
      ],
      "tags": [
        "final",
        "documentation-analyst"
      ],
      "counter_evidence": [
        "Repo memory captures repository shape, but not full operator intent or historical rollout decisions."
      ]
    },
    {
      "claim_id": "finding:unresolved-questions:primary",
      "title": "Open questions still block confident synthesis",
      "statement": "Reality memory still carries 2 unresolved question(s), so some claims would overstate certainty.",
      "status": "observed",
      "confidence": 0.88,
      "source_ids": [
        "source:repo-memory"
      ],
      "review_state": "cross_checked",
      "affected_repos": [
        "repo:sdp",
        "repo:sdp_dev"
      ],
      "open_questions": [
        "sdp: how does this repo coordinate versioning with the rest of the reposet?",
        "sdp_dev: how does this repo coordinate versioning with the rest of the reposet?"
      ],
      "tags": [
        "primary",
        "documentation-analyst"
      ]
    },
    {
      "claim_id": "finding:unresolved-questions:skeptic",
      "title": "Open questions still block confident synthesis skeptic review",
      "statement": "Open questions clearly exist, but severity should stay moderate until tied to concrete failures.",
      "status": "inferred",
      "confidence": 0.62,
      "source_ids": [
        "source:repo-memory"
      ],
      "review_state": "challenged",
      "affected_repos": [
        "repo:sdp",
        "repo:sdp_dev"
      ],
      "open_questions": [
        "sdp: how does this repo coordinate versioning with the rest of the reposet?",